[
  {
    "resource_type": "aws::ec2::vpc",
    "resource_id": "vpc-0fbd191d169cc9efb",
    "account_id": "891376942769",
    "account_name": "Portal-Dev",
    "region": "eu-south-2",
    "cidr_block": "10.12.0.0/16",
    "cidr_block_associations": [
      "10.12.0.0/16"
    ],
    "ipv6_cidr_blocks": [],
    "state": "available",
    "is_default": false,
    "dhcp_options_id": "dopt-0ef5151411f7dc49f",
    "instance_tenancy": "default",
    "tags": {
      "env": "dev",
      "assetid": "0003",
      "coid": "itl",
      "Name": "itl-0003-portal-dev-vpc-02",
      "apid": "portal"
    },
    "relationships": [
      {
        "resource_type": "aws::ec2::dhcp_options",
        "resource_id": "dopt-0ef5151411f7dc49f",
        "relation": "uses_dhcp"
      }
    ],
    "collected_at": "2026-08-15T07:50:17.516046+00:00"
  },
  {
    "resource_type": "aws::ec2::vpc",
    "resource_id": "vpc-086471f116a4c4c20",
    "account_id": "891376942769",
    "account_name": "Portal-Dev",
    "region": "eu-south-2",
    "cidr_block": "172.31.0.0/16",
    "cidr_block_associations": [
      "172.31.0.0/16"
    ],
    "ipv6_cidr_blocks": [],
    "state": "available",
    "is_default": true,
    "dhcp_options_id": "dopt-0ef5151411f7dc49f",
    "instance_tenancy": "default",
    "tags": {},
    "relationships": [
      {
        "resource_type": "aws::ec2::dhcp_options",
        "resource_id": "dopt-0ef5151411f7dc49f",
        "relation": "uses_dhcp"
      }
    ],
    "collected_at": "2026-08-15T07:50:17.516073+00:00"
  }
]